Product,Price,Rating,No. of reviews,Link
"Good knight Activ+ Liquid Refill, 45ml (Pack of 2) Red",125.00,4.2 out of 5 stars,849,https://www.amazon.in//Good-knight-Activ-Liquid-Refill/dp/B01N6BMUBK?_encoding=UTF8&psc=1
Classic Mosquito Net Foldable Flexible for Double Bed|King Size|Queen Size,"999.00 -    1,199.00",4.3 out of 5 stars,"1,771",https://www.amazon.in//Classic-Mosquito-Net-Foldable-Flexible/dp/B07PGZHDPC
"All Out Ultra Clear Refill Saver (270ml, Pack of 6)",334.00,3.7 out of 5 stars,"1,011",https://www.amazon.in//All-Out-Ultra-Clear-Refill/dp/B00VFMFXRC?_encoding=UTF8&psc=1
HIT Anti Roach Gel,175.00,4.0 out of 5 stars,"1,381",https://www.amazon.in//HIT-Ant1RoachGel-Anti-Roach-Gel/dp/B00YUNKKP8?_encoding=UTF8&psc=1
Good knight Fabric Roll-On Personal Mosquito Repellent 8ml,65.00,3.7 out of 5 stars,748,https://www.amazon.in//Good-knight-Personal-Mosquito-Repellent/dp/B01J7HVBKY?_encoding=UTF8&psc=1
"Classic Mosquito Net - Foldable, King Size Double Bed With Saviours - (Pink)",999.00,4.3 out of 5 stars,"1,387",https://www.amazon.in//Classic-Mosquito-Net-Foldable-Saviours/dp/B014T5PTQQ?_encoding=UTF8&psc=1
"Good Knight Activ+ 60 N Liquid Refill (Pack of 4, Red)",295.00,3.9 out of 5 stars,369,https://www.amazon.in//Good-Knight-Activ-Liquid-Refill/dp/B01J7HVBM2?_encoding=UTF8&psc=1
Good knight Power Activ+ Combi (Machine + Refill),85.00,4.2 out of 5 stars,806,https://www.amazon.in//Good-knight-Power-Machine-Refill/dp/B00K67QPME?_encoding=UTF8&psc=1
HIT Spray Dengue and Malaria Killer (400ml),176.00,4.0 out of 5 stars,269,https://www.amazon.in//HIT-Spray-Dengue-Malaria-Killer/dp/B00WK1DONW?_encoding=UTF8&psc=1
"Kisan Kraft KK-PS1000 Manual Sprayer (1 Litre, Color May Vary, Plastic)",195.00,4.1 out of 5 stars,531,https://www.amazon.in//Kisan-Kraft-KK-PS1000-Sprayer-Plastic/dp/B01AUPGA9O?_encoding=UTF8&psc=1
SUPER TOY Mosquito Bat Rechargeable Best - Multicolor,379.00,4.2 out of 5 stars,37,https://www.amazon.in//SUPER-TOY-Mosquito-Rechargeable-Best/dp/B07FRMRQ8C?_encoding=UTF8&psc=1
HIT Spray Flying Insect Killer (FIK) - 625 ml,255.00,4.1 out of 5 stars,102,https://www.amazon.in//HIT-Spray-Flying-Insect-Killer/dp/B00H0FIL6I?_encoding=UTF8&psc=1
Ardith Electronic Led Mosquito Killer Lamps Super Trap Mosquito Killer Machine For Home An Insect Killer Mosquito Killer Electric Machine Mosquito Killer Device Mosquito Trap Machine Eco-Friendly Baby Mosquito Insect Repellent Lamp,645.00,4.1 out of 5 stars,17,https://www.amazon.in//Ardith-Electronic-Mosquito-Eco-Friendly-Repellent/dp/B07P7SWWPL?_encoding=UTF8&psc=1
Cocogarden Cocopeat Brick,189.00 -    259.00,4.2 out of 5 stars,543,https://www.amazon.in//Cocogarden-Cocopeat-Brick/dp/B07LB5NJ5H
"All Out All Night Mosquito and Fly Spray (30ml, Blue)",159.20,3.3 out of 5 stars,216,https://www.amazon.in//All-Out-Night-Mosquito-Spray/dp/B01N5HPBBK?_encoding=UTF8&psc=1
Kisan Kraft KK-TS1000 Manual Sprayer (1 Litre) (Color May Vary),110.00,3.9 out of 5 stars,623,https://www.amazon.in//Kisan-Kraft-KK-TS1000-Manual-Sprayer/dp/B01BLFFC82?_encoding=UTF8&psc=1
Story@Home Mosquito Net 1,"899.00 -    1,299.00",3.9 out of 5 stars,18,https://www.amazon.in//Story-Home-Mosquito-Net-1/dp/B07PTQCFZG
"HIT Spray Crawling Insect Killer (400ml, Red)",176.00,4.1 out of 5 stars,305,https://www.amazon.in//HIT-Spray-Crawling-Insect-Killer/dp/B00XORDU9E?_encoding=UTF8&psc=1
Viola Mosquito Racket with Torch,449.00 -    599.00,3.8 out of 5 stars,113,https://www.amazon.in//Viola-Mosquito-Racket-with-Torch/dp/B07N88ZSNR
BirdFlee Polycarbonate Bird Spikes 5 pcs. Set,170.00,4.4 out of 5 stars,105,https://www.amazon.in//BirdFlee-Polycarbonate-Bird-Spikes-pcs/dp/B01LZQ48MT?_encoding=UTF8&psc=1
"All Out Ultra Refill (Clear, 2-Pieces)",130.00,3.7 out of 5 stars,131,https://www.amazon.in//All-Out-Ultra-Refill-2-Pieces/dp/B01N59MVB3?_encoding=UTF8&psc=1
Royal Foldable Single Bed Mosquito Net (Blue),899.00,4.0 out of 5 stars,247,https://www.amazon.in//Royal-Foldable-Single-Mosquito-Blue/dp/B017ZB62NA?_encoding=UTF8&psc=1
Kraft Seeds Garden Shears Pruners Scissor (Multicolour),135.00,3.6 out of 5 stars,916,https://www.amazon.in//Kraft-Seeds-Pruners-Scissor-Multicolour/dp/B0151NOFQA?_encoding=UTF8&psc=1
"Good knight Xpress System Liquid Cartridge,35ml",72.00,3.9 out of 5 stars,154,https://www.amazon.in//Good-knight-Xpress-System-Cartridge/dp/B011BXFQAI?_encoding=UTF8&psc=1
Healthy Sleeping Foldable Polyester Double Bed Mosquito Net,999.00,4.1 out of 5 stars,998,https://www.amazon.in//Healthy-Sleeping-Foldable-Polyester-Mosquito/dp/B07MG8LMQT
CINAGRO - Drip Irrigation Garden Watering 10 Plants Drip Kit,"388.00 -    1,498.00",4.1 out of 5 stars,148,https://www.amazon.in//CINAGRO-Irrigation-Garden-Watering-Plants/dp/B075PC9LL3
"LifeKrafts Mosquito Screen Curtain for Main Doors, Balcony Doors Or Kitchen Doors; Mesh with Magnets - Black",789.00 -    829.00,4.6 out of 5 stars,251,https://www.amazon.in//LifeKrafts-Mosquito-Curtain-Balcony-Kitchen/dp/B077FSS9JD
SMZ Brandlines Two Layer Lucky Bamboo Plant with Big Round Glass Pot (Free Seven Color Jelly/Crystal Ball Included),169.00,3.5 out of 5 stars,366,https://www.amazon.in//SMZ-Brandlines-Bamboo-crystal-included/dp/B01FARGL3W?_encoding=UTF8&psc=1
"Good knight Activ + Cartridge - Lavender, 45 ml",71.00,3.8 out of 5 stars,217,https://www.amazon.in//Good-knight-Activ-Cartridge-Lavender/dp/B01J7HVBNG?_encoding=UTF8&psc=1
"All Out Ultra Triple Refill (45ml, 3 Pieces, Clear)",Rs. 222.00,3.8 out of 5 stars,316,https://www.amazon.in//All-Out-Triple-Refill-Pieces/dp/B01MXSIAB8?_encoding=UTF8&psc=1
Good Knight Advanced Xpress Machine Plus Refill Combi (White),99.00,3.8 out of 5 stars,161,https://www.amazon.in//Good-Knight-Advanced-Xpress-Machine/dp/B01NBFESGP?_encoding=UTF8&psc=1
Hk Villa Electronic Led Mosquito Killer Lamps Super Trap Mosquito Killer Machine For Home An Insect Killer Mosquito Killer Electric Machine Mosquito Killer Device Mosquito Trap Machine Eco-Friendly Baby Mosquito Insect Repellent Lamp,498.00,3.1 out of 5 stars,79,https://www.amazon.in//Electronic-Mosquito-Electric-Eco-Friendly-Repellent/dp/B07NH8YRLD?_encoding=UTF8&psc=1
Good Morning Bed Bug Killer Powder (Pack of 5),440.00,4.1 out of 5 stars,805,https://www.amazon.in//Good-Morning-Killer-Powder-Pack/dp/B01D5D91K8?_encoding=UTF8&psc=1
Gadgetbucket UnTech Solar Motion Sensor Powerful LED Garden Wall Light,595.00 -    649.00,2.9 out of 5 stars,19,https://www.amazon.in//Gadgetbucket-UnTech-Motion-Sensor-Powerful/dp/B07PK768YF
Cocogarden Vermicompost - Complete Plant Food,174.00 -    599.00,3.8 out of 5 stars,796,https://www.amazon.in//Cocogarden-Vermicompost-Complete-Plant-Food/dp/B07L7VSSYQ
Shade Net 2 Mtr* 5 Mtr Shade Net Garden Netting Green House Agro UV Stabilized - 10 Square Meter (6.5Ft *16Ft),232.00,3.5 out of 5 stars,87,https://www.amazon.in//Shade-Garden-Netting-Green-Stabilized/dp/B0778BCHZX?_encoding=UTF8&psc=1
Good Morning Bed Bug Killer Spray Concentrate (Pack of 3),395.00,4.1 out of 5 stars,569,https://www.amazon.in//Good-Morning-Killer-Spray-Concentrate/dp/B01DAIL7AU?_encoding=UTF8&psc=1
"Shahji Creation Double Bed Mosquito Net, Ivory Color (7X7Feet)",240.00,3.2 out of 5 stars,242,https://www.amazon.in//Shahji-Creation-Double-Mosquito-7X7Feet/dp/B01L2F0OUW?_encoding=UTF8&psc=1
TrustBasket Enriched Organic Earth Magic Potting Soil Fertilizer for Plants,"349.00 -    1,033.00",4.2 out of 5 stars,34,https://www.amazon.in//TrustBasket-Enriched-Organic-Potting-Fertilizer/dp/B07NWV4P7R
"KACOOL Ultrasonic Pest Control Repeller, Insect Repellent Machine for Home Indoors Supersonic Cockroach Killer for Lizard Rats Rodents Mosquitoes Spiders Flies Ants Mice Roach",599.00 -    629.00,2.8 out of 5 stars,37,https://www.amazon.in//KACOOL-Ultrasonic-Repellent-Supersonic-Mosquitoes/dp/B07NVC889J
Zaavic 2 Layer Lucky Bamboo Plant with Big Round Glass Bowl and Colored Jelly Balls (Green),149.00,3.4 out of 5 stars,192,https://www.amazon.in//Zaavic-Layer-Lucky-Bamboo-Colored/dp/B0773VTMLX?_encoding=UTF8&psc=1
"First Smart Plastic Rectangle Pot (Brown, Pack of 3)",275.00,3.3 out of 5 stars,159,https://www.amazon.in//First-Smart-Deal-Plastic-Rectangle/dp/B019MKF53U?_encoding=UTF8&psc=1
Truphe Gardening Tools Set With Cutter And Gloves,549.00,4.1 out of 5 stars,356,https://www.amazon.in//Truphe-Gardening-Tools-Cutter-Gloves/dp/B01M7YY935?_encoding=UTF8&psc=1
BJE Mosquito Killing Racket - Color May Vary,297.00,3.4 out of 5 stars,63,https://www.amazon.in//BJE-Mosquito-Killing-Racket-Color/dp/B01KHQ7QL2?_encoding=UTF8&psc=1
Density Collection 20 LED Bright Outdoor Security Lights with Motion Sensor (Black),389.00,3.7 out of 5 stars,163,https://www.amazon.in//Density-Collection-Bright-Outdoor-Security/dp/B07KTQ816C?_encoding=UTF8&psc=1
HIT Spray Crawling Insect Killer (CIK) - 200 ml,98.00,4.3 out of 5 stars,208,https://www.amazon.in//HIT-Spray-Crawling-Insect-Killer/dp/B00LAPDNEY?_encoding=UTF8&psc=1
Bloom Buddy Organic Growth Booster 1Kg,330.00,3.7 out of 5 stars,209,https://www.amazon.in//Bloom-Buddy-Organic-Growth-Booster/dp/B072V2C572?_encoding=UTF8&psc=1
Organic Waste Decomposer Bottle of 30 ml/Rs 20 (+ Taxes 5% + Shipping) | Made by NCOF Technology | Easy Way to Convert Bio degradable Waste to Compost,210.00 -    770.00,4.2 out of 5 stars,203,https://www.amazon.in//Waste-Decomposer-Technology-degradable-fertilizer/dp/B07DZSW8HG
Cocogarden® Cocopeat Block,"399.00 -    1,199.00",4.5 out of 5 stars,880,https://www.amazon.in//Cocogarden%C2%AE-Cocopeat-Block/dp/B07M8ZWMK1
RAREERAM 2 in 1 Rechargeable Mosquito/Insect Racket BAT with Detachable LED Torch - White,399.00,3.5 out of 5 stars,666,https://www.amazon.in//RAREERAM-Rechargeable-Mosquito-Insect-Detachable/dp/B075LHZFP4?_encoding=UTF8&psc=1
