Product,Price,Rating,No. of reviews,Link
REDUX Analogue Black Dial Men's Watch (Rws0106),249.00,3.0 out of 5 stars,"1,634",https://www.amazon.in//REDUX-Analogue-Black-Watch-Rws0106/dp/B075FY4RWK?_encoding=UTF8&psc=1
Espoir Mens ESP12457 Analog Blue Dial Watch,290.00,3.5 out of 5 stars,"2,208",https://www.amazon.in//Espoir-Analog-Blue-Dial-Watch-ESP12457/dp/B07417987C?_encoding=UTF8&psc=1
Redux Analogue Brown Dial Men's & Boy's Watch RWS0200S,290.00,3.5 out of 5 stars,911,https://www.amazon.in//Redux-Analogue-Brown-Watch-RWS0200S/dp/B07D9G1GHB?_encoding=UTF8&psc=1
Redux Analogue Blue Dial Men's & Boy's Watch RWS0216S,299.00,3.6 out of 5 stars,123,https://www.amazon.in//Redux-Analogue-Blue-Watch-RWS0216S/dp/B07KVZD6XM?_encoding=UTF8&psc=1
Fastrack Reflex 2.0 Digital Black Dial Unisex's Watch-SWD90059PP05,"1,995.00",3.3 out of 5 stars,479,https://www.amazon.in//Fastrack-Reflex-Digital-Black-Watch-SWD90059PP05/dp/B07DQN5B3G?_encoding=UTF8&psc=1
SKMEI Analog-Digital Black Dial Men's Watch - AD1155 (BK White),526.00,4.1 out of 5 stars,"2,112",https://www.amazon.in//SKMEI-Analog-Digital-Black-Watch-AD1155-BK/dp/B01N0WVC16?_encoding=UTF8&psc=1
Geneva Platinum Analog Rose Gold Dial Women's Watch - g8027_D,317.00,3.7 out of 5 stars,722,https://www.amazon.in//Geneva-Analog-RoseGold-Womens-Watch-g8027_D/dp/B00VA4G63K?_encoding=UTF8&psc=1
Rich Club Pack of 4 Multicolour Analog Analog Watch for Men and Boys,399.00,3.3 out of 5 stars,508,https://www.amazon.in//Rich-Club-Multicolour-Analog-Watch/dp/B076Y4P7NQ?_encoding=UTF8&psc=1
Swisstyle Analogue White Dial & Black Dial Womens Watches (Ss-703W-703B)(Set of 2),449.00,3.4 out of 5 stars,"1,514",https://www.amazon.in//Swisstyle-Analogue-Womens-Watches-Ss-703W-703B/dp/B01BKEZYBY?_encoding=UTF8&psc=1
Fogg Analog White Day and Date Men's Watch 2047-WH,347.00,4.0 out of 5 stars,124,https://www.amazon.in//Fogg-Analog-White-Watch-2047-WH/dp/B079SB378M?_encoding=UTF8&psc=1
New ANALONG Combo Men Watches Pack of 3,299.99,3.5 out of 5 stars,9,https://www.amazon.in//New-ANALONG-Combo-Watches-Pack/dp/B07NTSTY8K?_encoding=UTF8&psc=1
SKMEI Digital Dial Men's Watch-1251 Black,579.00,4.2 out of 5 stars,627,https://www.amazon.in//SKMEI-Digital-Dial-Watch-1251-Black/dp/B0733GM3CK?_encoding=UTF8&psc=1
Espoir Analogue Blue Dial Day and Date Men's Boy's Watch - InfiDex0507,290.00,3.5 out of 5 stars,124,https://www.amazon.in//Espoir-Analogue-Blue-Dial-Watch/dp/B07JBJ8FW6?_encoding=UTF8&psc=1
Sonata Digital Grey Dial Men's Watch -NK7982PP04,399.00,4.3 out of 5 stars,"1,686",https://www.amazon.in//Sonata-Digital-Grey-Dial-Watch-NK7982PP04/dp/B00B81QJBO?_encoding=UTF8&psc=1
Sonata Analog White Dial Men's Watch -NJ7987YL02W,530.00,4.1 out of 5 stars,697,https://www.amazon.in//Sonata-Analog-White-Dial-Watch-NJ7987YL02W/dp/B00K2Q2SFW?_encoding=UTF8&psc=1
Timex Analog Blue Dial Men's Watch-TW00ZR262E,975.00,4.1 out of 5 stars,235,https://www.amazon.in//Timex-Analog-Blue-Dial-Watch-TW00ZR262E/dp/B07H3K85H5?_encoding=UTF8&psc=1
Foxter Pack of 3 Multicolour Analog Analog Watch for Men and Boys,399.00,3.8 out of 5 stars,39,https://www.amazon.in//Foxter-Pack-Multicolour-Analog-Watch/dp/B07MXF1SX2?_encoding=UTF8&psc=1
Fogg Analog Black Dial Women's Watch 4049-BK,330.00,3.9 out of 5 stars,216,https://www.amazon.in//Fogg-Analog-Black-Womens-4049-BK/dp/B078GV6NNG?_encoding=UTF8&psc=1
Fogg Stainless Steel Day and Date Blue Dial Analog Mens Watch (2038-BL),322.00,3.7 out of 5 stars,"1,269",https://www.amazon.in//Fogg-Stainless-Steel-Analog-2038-BL/dp/B075RBD78J?_encoding=UTF8&psc=1
Timewear Military Series Analogue Digital Black Dial Watch for Men & Boys - 1283 Green,604.00,3.9 out of 5 stars,22,https://www.amazon.in//Timewear-Military-Analogue-Digital-Black/dp/B07L3351J4?_encoding=UTF8&psc=1
Kitcone Analogue Multi Colour Anchor Dial Crystal Glass Womens & Girls Watches - SLL,499.00,4.1 out of 5 stars,14,https://www.amazon.in//Kitcone-Analogue-Colour-Crystal-Watches/dp/B07PGGXWF3?_encoding=UTF8&psc=1
Swisstone BRW385-BRWN Brown Leather Strap Wrist Watch for Men,399.00,3.9 out of 5 stars,153,https://www.amazon.in//Swisstone-BRW385-BRWN-Brown-Leather-Strap/dp/B07H3489LV?_encoding=UTF8&psc=1
ZIERA ZR945 Blue Leather Strap Day & Date Watch - for Men,249.00,5.0 out of 5 stars,2,https://www.amazon.in//ZIERA-ZR945-Leather-Strap-Watch/dp/B07P5ZFQZP?_encoding=UTF8&psc=1
"Fastrack Analog Dial Women's Watch (Pink, 6150SM04)-NK6150SM04","1,595.00",4.4 out of 5 stars,496,https://www.amazon.in//Fastrack-Analog-Womens-6150SM04-NK6150SM04/dp/B01GDWNV68?_encoding=UTF8&psc=1
Fossil Analog Rose Gold Dial Women's Watch - BQ3181,"5,697.00",4.6 out of 5 stars,85,https://www.amazon.in//Fossil-Analog-Rose-Womens-Watch-BQ3181/dp/B078Y2PJL4?_encoding=UTF8&psc=1
Fogg Brown Day and Date Men's Watch 1164-BR,299.00,3.9 out of 5 stars,133,https://www.amazon.in//Fogg-Brown-Date-Watch-1164-BR/dp/B07J5SVQK4?_encoding=UTF8&psc=1
Eddy Hager Blue Day & Date Men's Watch EH-154-BL,199.00,4.0 out of 5 stars,3,https://www.amazon.in//Eddy-Hager-Blue-Watch-EH-154-BL/dp/B07MX7SR42?_encoding=UTF8&psc=1
Acnos Special Super Quality Analog Watches Combo Look Like Preety for Girls and Women Pack of - 3(605-BLK-ORG-SKY),339.00,3.4 out of 5 stars,13,https://www.amazon.in//Acnos-Special-Quality-Analog-Watches/dp/B07L3NX67M?_encoding=UTF8&psc=1
Sonata Analog Blue Dial Women's Watch -NJ8989PP04C,480.00,4.1 out of 5 stars,571,https://www.amazon.in//Sonata-Analog-Blue-Womens-Watch-NJ8989PP04C/dp/B00KCOPWY8?_encoding=UTF8&psc=1
"Watch for Kids/Mens Black/Red/Blue/White Colour Silicone Digital LED Bracelet Band Wrist Watch for Kids, Boys/Men/Girls/Digital Watch Men Women skmi Children Watches for Girls",160.00 -    299.00,3.7 out of 5 stars,4,https://www.amazon.in//Silicone-Digital-Bracelet-Children-Watches/dp/B07NZ18SL8
LIMESTONE Analogue Black The Wolf Series Mesh Strap Men's Watch,99.00,4.0 out of 5 stars,4,https://www.amazon.in//LimeStone-Wolf-Strap-Analog-Watch/dp/B07CZ1F51D?_encoding=UTF8&psc=1
Skmei Analog-Digital Black Dial Men's Watch - 1155-Blue,467.00,3.8 out of 5 stars,403,https://www.amazon.in//Skmei-Analog-Digital-Black-Dial-Watch-1155-Blue/dp/B01CCHPXFA?_encoding=UTF8&psc=1
Redux Analogue Brown Dial Men's & Boy's Watch RWS0215S,299.00,3.9 out of 5 stars,42,https://www.amazon.in//Redux-Analogue-Brown-Watch-RWS0215S/dp/B07KVZV5QZ?_encoding=UTF8&psc=1
Lamkei LMK-0085 Watch for Men - Fashion Sports Luxury Casual Analogue Quartz Black Dial Black Synthetic Strap Stylish Latest Men's Watch,399.00,3.2 out of 5 stars,7,https://www.amazon.in//Lamkei-LMK-0085-Watch-Men-Synthetic/dp/B07N7QG88Z?_encoding=UTF8&psc=1
Attractionz Analog Multi-Colour Women's & Girls Watch -BS 1,419.00,3.9 out of 5 stars,44,https://www.amazon.in//Attractionz-Analog-Multi-Colour-Womens-Girls/dp/B07H7SC154?_encoding=UTF8&psc=1
Eddy Hager Black Day and Date Men's Watch EH-250-BK,329.00,4.1 out of 5 stars,54,https://www.amazon.in//Eddy-Hager-Black-Watch-EH-250-BK/dp/B07L5LH8YS?_encoding=UTF8&psc=1
Armado AR-81019361 Combo of 4 Multicolours Watches,399.00,3.6 out of 5 stars,60,https://www.amazon.in//Armado-AR-81019361-Combo-Multicolours-Watches/dp/B07J574DLN?_encoding=UTF8&psc=1
Redux Analogue Blue Dial Men's & Boy's Watch RWS0130S,279.00,3.2 out of 5 stars,363,https://www.amazon.in//Redux-Analogue-Blue-Watch-RWS0130S/dp/B0785JJF7L?_encoding=UTF8&psc=1
"LORENZ Combo Of Black Men's Wallet ,Sunglasses & Watch",549.00,3.6 out of 5 stars,46,https://www.amazon.in//LORENZ-Combo-Black-Wallet-Sunglasses/dp/B07CBLTVSN?_encoding=UTF8&psc=1
Cloudwood Analog Bangle Gold Dial Luxury Fashion Bracelet Watch for Women & Girls -W158,199.00,3.9 out of 5 stars,8,https://www.amazon.in//Cloudwood-Analog-Bangle-Fashion-Bracelet/dp/B07L6L8S82?_encoding=UTF8&psc=1
Skmei Analogue-Digital Military Green Strap Men's & Boy's Watch - 1283,699.00,3.8 out of 5 stars,80,https://www.amazon.in//Skmei-Analogue-Digital-Military-Green-Strap/dp/B07HP37F9W?_encoding=UTF8&psc=1
Foxter Pack of 6 Multicolour Analog Analog Watch for Men and Boys,599.00,3.7 out of 5 stars,54,https://www.amazon.in//Foxter-Pack-Multicolour-Analog-Watch/dp/B07LBRD9PM?_encoding=UTF8&psc=1
CARTNEY Analogue Black Dial Combo Of 2 Women's & Girl's Watch - Cty0107,268.00,3.9 out of 5 stars,142,https://www.amazon.in//CARTNEY-Analogue-Black-Combo-Womens/dp/B0767NTN37?_encoding=UTF8&psc=1
SWISSTONE Analogue Pink Dial Silver Plated Bracelet Women's Wrist Watch,449.00,3.9 out of 5 stars,104,https://www.amazon.in//SWISSTONE-Analogue-Silver-Plated-Bracelet/dp/B07FCPL5NX?_encoding=UTF8&psc=1
Fossil Dean Chronograph Analog Black Dial Men's Watch - FS4542,"5,097.00",4.5 out of 5 stars,238,https://www.amazon.in//Fossil-Chronograph-Analog-Black-Watch/dp/B0064NDWPC?_encoding=UTF8&psc=1
PIRASO Fasttrend Analogue Black Dial Girl's Watch- PW3-07,479.00,4.3 out of 5 stars,508,https://www.amazon.in//PIRASO-Fasttrend-Analogue-Watch-PW3-07/dp/B07427N9QS?_encoding=UTF8&psc=1
Timewear Military Series Analogue Digital Black Dial Watch For Men & Boys - 12121283,603.00,4.1 out of 5 stars,72,https://www.amazon.in//Timewear-Military-Analogue-Digital-Black/dp/B0799M45HN?_encoding=UTF8&psc=1
Fastrack Casual Analog White Dial Men's Watch -NJ3114PP01C,915.00,4.0 out of 5 stars,511,https://www.amazon.in//Fastrack-Casual-Analog-White-Watch-NJ3114PP01C/dp/B00NLASVBQ?_encoding=UTF8&psc=1
Swadesi Stuff Digital Black Dial Boy's Watch- 5696,199.00,3.4 out of 5 stars,6,https://www.amazon.in//Swadesi-Stuff-Digital-Black-Watch/dp/B079XLCKPQ?_encoding=UTF8&psc=1
Espoir Exclusive Series White Dial Day & Date Analogue Boys And Mens Watch-Oliver0507,249.00,3.6 out of 5 stars,334,https://www.amazon.in//Espoir-Analog-White-Dial-Watch-ES133/dp/B07B6SN496?_encoding=UTF8&psc=1
